<?xml version="1.0" encoding="UTF-8"?>

<!-- Flat display of all the demo models -->
<ModelMenu xmlns="http://www.artisynth.org" xmlns:xsi="http://www.w3.org/2001/XMLSchema-instance"
	xsi:schemaLocation="http://www.artisynth.org modelmenu.xsd">

	<label text=" FEM" fontstyle="italic" />
	<include file="src/artisynth/core/modelmenu/femdemos.xml" />
	<separator />
	<label text=" Jaw/Tongue" fontstyle="italic" />
	<include file="src/artisynth/core/modelmenu/jawtonguedemos.xml" />
	<separator />
	<label text=" Inverse" fontstyle="italic" />
	<include file="src/artisynth/core/modelmenu/inversedemos.xml" />
	<separator />
	<label text=" Mech" fontstyle="italic" />
	<include file="src/artisynth/core/modelmenu/mechdemos.xml" />
	<separator />
	<label text=" Misc" fontstyle="italic" />
	<include file="src/artisynth/core/modelmenu/miscdemos.xml" />
</ModelMenu>